{
  "schema_version": "1.0.0",
  "problem_id": "circle_packing_n26",
  "problem_spec_sha256": "5bb556613bb44a4834642912735b9cd1eab2346a80654119a2a6e774658eafa7",
  "claim_type": "demonstration",
  "construction": {
    "centers": [
      [
        "1/10",
        "1/10"
      ],
      [
        "1/10",
        "3/10"
      ],
      [
        "1/10",
        "5/10"
      ],
      [
        "1/10",
        "7/10"
      ],
      [
        "1/10",
        "9/10"
      ],
      [
        "3/10",
        "1/10"
      ],
      [
        "3/10",
        "3/10"
      ],
      [
        "3/10",
        "5/10"
      ],
      [
        "3/10",
        "7/10"
      ],
      [
        "3/10",
        "9/10"
      ],
      [
        "5/10",
        "1/10"
      ],
      [
        "5/10",
        "3/10"
      ],
      [
        "5/10",
        "5/10"
      ],
      [
        "5/10",
        "7/10"
      ],
      [
        "5/10",
        "9/10"
      ],
      [
        "7/10",
        "1/10"
      ],
      [
        "7/10",
        "3/10"
      ],
      [
        "7/10",
        "5/10"
      ],
      [
        "7/10",
        "7/10"
      ],
      [
        "7/10",
        "9/10"
      ],
      [
        "9/10",
        "1/10"
      ],
      [
        "9/10",
        "3/10"
      ],
      [
        "9/10",
        "5/10"
      ],
      [
        "9/10",
        "7/10"
      ],
      [
        "9/10",
        "9/10"
      ],
      [
        "1/5",
        "1/5"
      ]
    ],
    "radii": [
      "1/10",
      "1/10",
      "1/10",
      "1/10",
      "1/10",
      "1/10",
      "1/10",
      "1/10",
      "1/10",
      "1/10",
      "1/10",
      "1/10",
      "1/10",
      "1/10",
      "1/10",
      "1/10",
      "1/10",
      "1/10",
      "1/10",
      "1/10",
      "1/10",
      "1/10",
      "1/10",
      "1/10",
      "1/10",
      "1/30"
    ]
  },
  "claimed_score": "38/15",
  "best_known": null,
  "run": null,
  "verifiers": {
    "exact_sha256": "86d806da13eba2948b30a1f850393159e7b51fa179a05175558f79af8d3e102c",
    "independent_sha256": "891b473ab2eeb7d5fc866b4cca35b20ea3bbd44846feca0c718bed75e79d3412"
  },
  "created_at": "2026-10-18T16:08:02Z",
  "certificate_sha256": "9f6ed59c69fffb4998e4a1b0c83fcbb9c201ab6581e5b736d4fbccbadb4c13a9"
}