{
  "schema_version": "1.0.0",
  "problem_id": "circle_packing_n26",
  "problem_spec_sha256": "5bb556613bb44a4834642912735b9cd1eab2346a80654119a2a6e774658eafa7",
  "claim_type": "reproduction",
  "construction": {
    "centers": [
      [
        "1/8",
        "1/8"
      ],
      [
        "1/8",
        "3/8"
      ],
      [
        "1/8",
        "5/8"
      ],
      [
        "1/8",
        "7/8"
      ],
      [
        "3/8",
        "1/8"
      ],
      [
        "3/8",
        "3/8"
      ],
      [
        "3/8",
        "5/8"
      ],
      [
        "3/8",
        "7/8"
      ],
      [
        "5/8",
        "1/8"
      ],
      [
        "5/8",
        "3/8"
      ],
      [
        "5/8",
        "5/8"
      ],
      [
        "5/8",
        "7/8"
      ],
      [
        "7/8",
        "1/8"
      ],
      [
        "7/8",
        "3/8"
      ],
      [
        "7/8",
        "5/8"
      ],
      [
        "7/8",
        "7/8"
      ],
      [
        "1/4",
        "1/16"
      ],
      [
        "3/4",
        "1/16"
      ],
      [
        "1/4",
        "15/16"
      ],
      [
        "3/4",
        "15/16"
      ],
      [
        "1/16",
        "1/4"
      ],
      [
        "1/16",
        "3/4"
      ],
      [
        "15/16",
        "1/4"
      ],
      [
        "15/16",
        "3/4"
      ],
      [
        "1/16",
        "1/16"
      ],
      [
        "15/16",
        "15/16"
      ]
    ],
    "radii": [
      "49416650145666987/1000000000000000000",
      "62223618972081437/1000000000000000000",
      "1172823284048671/15625000000000000",
      "83644088352247347/1000000000000000000",
      "77894613595382813/1000000000000000000",
      "57369007075911221/1000000000000000000",
      "3828688980216699/50000000000000000",
      "25122418605826643/250000000000000000",
      "87088957812266221/1000000000000000000",
      "178972202350659/1562500000000000",
      "398312766515107/3125000000000000",
      "4594411758957103/50000000000000000",
      "21360859386503967/250000000000000000",
      "97424583448945529/1000000000000000000",
      "92550159948571339/1000000000000000000",
      "53371088262193547/1000000000000000000",
      "57888105166786857/1000000000000000000",
      "10356831809636039/250000000000000000",
      "19632287085213901/500000000000000000",
      "9674369481019171/250000000000000000",
      "1890730820296243/31250000000000000",
      "56110160241487027/1000000000000000000",
      "8465933028957769/200000000000000000",
      "44495708237794993/1000000000000000000",
      "4871462187830689/125000000000000000",
      "4377157423264869/125000000000000000"
    ]
  },
  "claimed_score": "1787146240596586469/1000000000000000000",
  "best_known": {
    "value": "1787146240596586469/1000000000000000000",
    "source_url": "https://example.com/smoke_run",
    "retrieved_date": "2026-10-18"
  },
  "run": {
    "run_id": "circle_packing_n26_2b4ce989",
    "engine": "openevolve",
    "engine_version": "0.4.0",
    "model": "gemini-2.5-flash",
    "iterations": 20,
    "best_fast_score": "1.7871462405966057",
    "shrink_loss_exact": "10633048374027903/549755813888000000000000000000"
  },
  "verifiers": {
    "exact_sha256": "86d806da13eba2948b30a1f850393159e7b51fa179a05175558f79af8d3e102c",
    "independent_sha256": "891b473ab2eeb7d5fc866b4cca35b20ea3bbd44846feca0c718bed75e79d3412"
  },
  "created_at": "2026-10-18T16:08:30Z",
  "certificate_sha256": "2be2520cf8c3f30058fc671ab3af9c6c5f576bb0cbc8b90d25e24fd6e1c6dd0a"
}